jenmi	gismu   	-jem-   	-jei-	      	x_1 bilni gunma lo sonci gi'e selfu x_2 x_3	{bilni}; {gunma}; {sonci}; {selfu}
jersi	gismu   	-je'i-		      	x_1 trixe x_2 gi'e dunli x_2 lo ka muvdu fa'a ma kau	{trixe}; {dunli}; {muvdu}; {farna}; {bavla'i}; {kavbu}; {kalte}; {lidne}; {rivbi}
jerxo	gismu   	-jex-		      	x_1 ckini lo kulnu ja bangu ja cecmu ja natmi pe lo gugdeduzu x_2	{kulnu}; {bangu}; {cecmu}; {natmi}; {gugdeduzu}; {friko}; {xrabo}
jesni	gismu   	-jes-		      	x_1 cinla je sirji li'ismi gi'e se jipno lo kinli gi'e marji x_2	{cinla}; {sirji}; {li'ismi}; {jipno}; {kinli}; {marji}
jetce	gismu   	-je'e-		      	x_1 flecu x_2 fo x_3 gi'e se tolsakci x_3	{flecu}; {tolsakci}
jetnu	gismu   	-jet-   	-je'u-	      	x_1 mapti lo fatci lo ka ce'u ve skicu ce'u fo x_2 .i x_1 to'e jitfa x_2	{mapti} .i {fatci} .i {jitfa} .i {skicu}
jgalu	gismu   	-ja'u-		      	x_1 jdari gi'e pagbu lo jipno be lo degji be x_2	srana fa zo {degji}
jgari	gismu   	-jai-		      	x_1 gasnu lo nu x_4 noi pagbu x_2 cu rinju x_3 noi pagbu x_1
jgena	gismu   	-jge-		      	x_1 gunma lo kucysi'u clupa be x_2	{gunma}; {kucysi'u}; {clupa}
jgira	gismu   	-jgi-		      	x_1 cinmo lo ka se pluka ja gleki lo nu x_1 snada ja zukte ja ckaji x_2 .i x_1 to'e ckeji ja to'e zungi x_2	{cinmo}; {pluka}; {gleki}; {snada}; {zukte}; {ckaji}; {ckeji}; {zungi}
jibni	gismu   	-jbi-		      	x_1 sepli x_2 lo cmalu be x_3 .i x_1  to'e darno x_2 x_3	{sepli}; {cmalu}; {darno}
jibri	gismu   	-jib-		      	x_1 dikni ja tcaci se gunka x_2 lo ka jerna lo se pleji	{dikni}; {tcaci}; {gunka}; {jerna}; {pleji}; {briju}
jicla	gismu			      	x_1 nalcadgau x_2 ja'e lo nu x_2 mixre ja runta ja glajdika	{nalcadgau}; {mixre}; {runta}; {glajdika}
jicmu	gismu   	-cmu-		      	x_1 fai lo ka zasti ja fatci cu jai ralju ja pa moi lo krinu ja se jalge be lo nu x_2 zasti ja fatci	{zasti}; {fatci}; {ralju}; {krinu}; {jalge}; {krasi}; {zbepi}
jijnu	gismu   	-jij-		      	x_1 djuno x_2 x_3 fi'o na se jalge lo pruce fo lo nu pensi	{djuno}; {jalge}; {pensi}
jikca	gismu   	-jik-		      	x_1 kansa x_2 lo ka simxu lo ka tarti lo ka pendo 	{kansa}; {simxu}; {tarti}; {pendo}; {penmi}
jimpe	gismu   	-jmi-		      	x_1 sanji lo smuni be x_2 noi datni x_3	{sanji}; {smuni}; {datni}
jimte	gismu   	-jit-		      	x_1 pagbu ja sepcau x_2 gi'e se bancu no pagbu be x_2 lo pagbu be x_2 x_3	{pagbu}; {sepcau}; {bancu}; {traji}; {korbi}; {kuspe}
jinci	gismu			      	x_1 tutci lo ka katna x_2 kei gi'e se pagbu lo re balre noi ke'a jonsi'u ja'e lo nu lo kinli korbi be ke'a cu prosi'u	{tutci}; {katna}; {pagbu}; {balre}; {jonsi'u}; {kinli}; {korbi}; {prosi'u}
jinga	gismu   	-jig-   	-ji'a-	      	x_1 cpacu x_2 noi prali x_1 lo ka zmadu x_3 lo ni snada x_4 	{cpacu}; {prali}; {zmadu}; {snada}; {jivna}; {jerna}
jinku	gismu			      	x_1 bandu x_2 lo nu x_2 bilma fi x_3 ta'i lo nu lo xadni bandu ciste cu frati lo nu cupra lo bandu lanbi kei lo nu setca x_1 lo xadni be x_2 ta'i x_4	{bandu}; {bilma}; {xadni}; {ciste}; {frati}; {cupra}; {lanbi}; {setca}
jinru	gismu   	-jir-		      	x_1 mulno lo ka se sruri x_2 noi litki .i x_1 cnita lo sefta be x_2 noi litki	{mulno}; {sruri}; {litki}; {cnita}; {sefta}
jinsa	gismu   	-jis-		      	x_1 claxu x_2 noi dertu gi'a pulce gi'a drata ke na'e mapti marji	{claxu}; {dertu}; {pulce}; {drata}; {mapti}; {marji}
jinto	gismu			      	x_1 ve flecu x_2 gi'e se stuzi x_3	{flecu}; {stuzi}
jinvi	gismu   	-jiv-   	-ji'i-	      	x_1 krici x_2 x_3 ji'u x_4	{krici}; {jicmu}; {djuno}; {birti}; {senpi}; {jijnu}; {sruma}; {smadi}; {facki}; {cilre}; {jimpe}; {morji}; {jdice}; {xusra}
jinzi	gismu   	-jiz-		      	lo nu x_1 se ckaji x_2 cu rarna gi'e na se gasnu .i x_1 se ckaji x_2 co'a lo nu x_2 zasti .i x_2 cu ro roi pu ckaji x_1	srana fa zo {lakne} .e zo {rarna} .e zo {stati} .e zo {tcaci} .e zo {kakne} .e zo {ckaji}
jipci	gismu			      	x_1 cange cipni x_2 noi jutsi la'o jutsi Gallus domesticus jutsi	{cange}; {cipni}; {jutsi}; {xruki}; {datka}; {gunse}
jirna	gismu			      	x_1 jdari gi'e xadypau x_2 gi'e se jipno lo kinli gi'e se jinto fi lo pagbu be lo sedbo'u be x_2 ku poi gabru lo mebri be ri	srana fa zo {kinli}
jisra	gismu			      	x_1 litki gi'e pagbu ja se krasi x_2	{litki}; {pagbu}; {krasi}
jitfa	gismu   	-jif-		      	x_1 na mapti lo fatci lo ka ce'u ve skicu ce'u fo x_2 .i x_1 to'e jetnu x_2	{mapti} .i {fatci} .i {jetnu} .i {skicu}
jitro	gismu   	-tro-		      	x_1 vlipa lo ka gasnu lo nu x_2 zukte ja ckaji x_3 kei gi'a jdice lo du'u xu kau x_2 zukte ja ckaji x_3 kei gi'a jdice lo du'u ta'i ma kau x_2 zukte ja ckaji x_3	{vlipa}; {gasnu}; {zukte}; {ckaji}; {jdice}; {gidva}; {bapli};  {jatna}; {minde}; {sazri}; {turni}; {xlura}
jivbu	gismu			      	x_1 zbasu x_2 x_3 noi skori ja cilta ku'o ta'i lo nu x_1 gasnu lo nu x_3 kucysi'u	{zbasu}; {skori}; {cilta}; {gasnu}; {kucysi'u}; {nivji}
jivna	gismu   	-jvi-		      	x_1 fapro x_2 x_3 gi'e troci lo ka jinga fi x_2 fo x_3 fe x_4	{fapro}; {troci}; {jinga}
jmaji	gismu   	-jaj-		      	ge ro me x_1 cu klama x_2 boi su'o me x_3 gi ro me x_3 cu te klama x_2 boi su'o me x_1 vau ja'e lo nu x_1 zvati x_2	{klama} .i {penmi} .i {pensi'u}
jmina	gismu   	-min-		      	x_1 dunda x_2 boi x_3 ja'e x_4 i x_1 gasnu lo nu x_3 zenba fi x_2 ja'e x_4
jmive	gismu   	-miv-   	-ji'e-	      	x_1 se tcini lo ka jbena gi'e banro gi'e ka'e rorci gi'e matybi'o lo vanbi ta'i lo nu nenri krasi cenba .i x_1 to'e morsi	{tcini}; {jbena}; {banro}; {rorci}; {matybi'o}; {vanbi}; {nenri}; {krasi}; {cenba}; {morsi}
jordo	gismu   	-jor-   	-jo'o-	      	x_1 ckini lo kulnu ja bangu ja cecmu ja natmi pe lo gugdeju'o x_2	{kulnu}; {bangu}; {cecmu}; {natmi}; {gugdeju'o}; {xazdo}; {semto}; {xrabo}
jorne	gismu   	-jon-   	-jo'e-	      	x_3 korbi x_1 fi x_2 .i je x_1 jo'u x_2 rinju x_3 lo ka simxu lo ka zvadarze'a	srana fa zo {korbi} .e zo {snipa} .e zo {lasna} .e zo {rinju} .e zo {zvadarze'a}
jubme	gismu   	-jub-   	-jbu-	      	x_1 nilce gi'e marji x_2 gi'e se galraipau lo pinta plita poi se zbepi x_3	{nilce}; {marji}; {galraipau}; {pinta}; {plita}; {zbepi}
judri	gismu			      	x_1 sinxa lo du'u ma kau stuzi x_2 kei ma'i x_3	{sinxa}; {stuzi}; {manri}
jufra	gismu   	-juf-   	-ju'a-	      	x_1 porsi lo su'o pa valsi gi'e se smuni lo srana be x_2 gi'e gerna selci x_3 noi bangu	{porsi}; {valsi}; {smuni}; {srana}; {gerna}; {selci}; {bangu}
jukpa	gismu   	-jup-		      	x_1 bregau x_2 lo ka se citka kei ta'i x_3	{bregau}; {citka}; {cidja}; {zbasu}
jundi	gismu   	-jud-   	-ju'i-	      	x_1 selfargau lo menli be vo'a x_2	{selfargau} .i {menli} .i {zgana}
jungo	gismu   	-jug-		      	x_1 ckini lo kulnu ja bangu ja cecmu ja natmi pe lo banzuxe'o ja gugdecunu x_2	{kulnu}; {bangu}; {cecmu}; {natmi}; {banzuxe'o}; {gugdecunu}; {xazdo}
junla	gismu   	-jul-		      	x_1 tutci lo ka merli lo temci kei gi'a jarco lo tcika .a lo detri 	{tutci}; {merli}; {temci}; {jarco}; {tcika}; {detri}
junri	gismu   	-jur-		      	x_1 zukte ja ckaji x_2 se kai lo ka vajni .i x_1 to'e xalbo x_2	{vajni}; {xalbo}
jutsi	gismu   	-jut-		      	x_1 klesi x_2 noi klesi x_3 noi klesi x_4 li'o	{klesi}; {lanzu}
juxre	gismu   	-jux-		      	x_1 zukte ja ckaji x_2 gi'e claxu lo ka certu ja stati x_2 gi'a melbi fi x_2	{zukte}; {ckaji}; {claxu}; {certu}; {stati}; {melbi}
jvinu	gismu   	-vin-   	-ji'u-	      	x_1 se krasi x_2 gi'e ka'e se viska bu'u x_3	{viska}; {sance}; {panci}; {vrusi}; {tengu} 
kabri	gismu			      	x_1 cmalu je kalri vautci x_2 gi'e marji x_3 gi'e na'o tutci lo ka te pinxe	{cmalu}; {kalri}; {vautci}; {marji}; {pinxe}; {tutci}
kadno	gismu			      	x_1 ckini lo kulnu ja bangu ja cecmu ja natmi pe lo gugdecu'a x_2	{kulnu}; {bangu}; {cecmu}; {natmi}; {gugdecu'a}; {bemro}; {glico}; {fraso}
kajde	gismu   	-jde-		      	x_1 rinka lo nu x_2 sanji lo nu x_3 ckape x_2	{rinka}; {sanji}; {ckape}
kajna	gismu			      	x_1 pinta tanbo gi'e se sarji x_2 noi mu'a bitmu gi'a se pagbu be x_1 nilce ku'o gi'e tutci x_3	{pinta}; {tanbo}; {sarji}; {bitmu}; {pagbu}; {nilce}; {tutci}
kakne	gismu   	-ka'e-		      	lo nu x_1 zukte ja ckaji x_2 cu cumki x_3	{zukte}; {ckaji}; {cumki}
kalri	gismu   	-kar-		      	lo nu pagre x_1 boi (to noi vorme toi) x_2 fa x_3 fo zi'o cu nalselzu'i zi'o zi'o	ko catlu fe ji'a zo {ganlo} .e zo {pagre} .e zo {canko} .e zo {vorme} .e zo {nalselzu'i}
kalsa	gismu   	-kas-		      	x_1 jai se morna lo cunso ja to'e te ganzu fai x_2 .i x_1 to'e cnici x_2	{morna}; {cunso}; {ganzu}; {cnici}
kampu	gismu   	-kau-		      	ckaji x_1 fa ro me x_2 .i va'i roldza fa lo ka ce'u ckaji x_1 gi'e me x_2	srana fa zo {tolkau} .e zo {nartolkau} .e zo {narkau} .e zo {roldza}
kamro	experimental gismu			      	x_1 ckini lo kulnu ja bangu ja cecmu ja natmi pe lo bancujemu x_2	{kulnu}; {bangu}; {cecmu}; {natmi}; {bancujemu}; {ropno}; {brito}
kanba	gismu			      	x_1 rapmarxa mabru x_2 noi jutsi la'o jutygunma Capra jutygunma	{rapmarxa}; {mabru}; {jutsi}; {lanme}; {bakni}; {kumte}; {mirli}; {djirafa}
kancu	gismu   	-kac-		      	x_1 merli x_2 boi x_3 lo ka xo kau da me ce'u ma'i x_4 .i x_1 merli x_2 ja'e lo nu x_1 djuno ja pajni lo du'u x_2 memkai x_3 
kandi	gismu   	-kad-		      	x_1 toltce x_2 fi'o ganse x_3; x_1 to'e carmi x_2 x_3	{toltce}; {ganse}; {carmi}
kanji	gismu   	-kaj-		      	x_1 pilno fi lo ka facki x_2 kei fe x_3 noi datni ku'o ta'i x_4 noi logji x_3	{pilno}; {facki}; {datni}; {logji}; {kancu}
kanla	gismu   	-kal-		      	x_1 rango x_2 lo ka se pilno x_2 lo ka viska	{rango}; {pilno}; {viska}
kanpe	experimental gismu			      	x_1 sruma ja jinvi lo du'u lo nu x_2 ba fasnu cu lakne gi'e la'erlai x_3	srana fa zo {pacna} .e zo {sruma} .e zo {lakne}
kanro	gismu   	-ka'o-		      	x_1 se tcini lo ka lo xadni ja menli be ce'u cu tolpo'u gi'e vlipa .i x_1 na'e bilma	{tcini}; {xadni}; {menli}; {tolpo'u}; {vlipa}; {bilma}; {mikce}
kansa	gismu   	-kan-		      	x_1 joi x_2 lifri x_3
kantu	gismu   	-ka'u-		      	x_1 klani lo cmarai x_2	{klani}; {cmarai}; {selci}
kanxe	gismu   	-kax-		      	x_1 du'u ge x_2 gi x_3 jetnu	{du'u}; {ge}; {vlina}; {natfe}
karbi	gismu   	-kab-		      	x_1 lanli x_2 jo'u x_3 te zu'e lo nu x_1 facki lo du'u xu kau x_2 simsa x_3 boi x_4 .i x_1 cipyzu'e x_2 jo'u x_3 lo ka ce'u simsysi'u fa'u fricysi'u ma kau fa'u ma kau	srana fa zo {cipyzu'e} .e zo {klani} .e zo {mapti} .e zo {sarxe} .e zo {zmadu} .e zo {mleca} .e zo {dunli} .e zo {lanli} .e zo {merli} .e zo {simsa} .e zo {zgana}
karce	gismu			      	x_1 se matra je se sabnu marce x_2 fo x_3 gi'e na'o se xislu lo vo mei	{matra}; {sabnu}; {marce}; {xislu}
kargu	gismu			      	x_1 mutce lo ka ma kau ce'u jdima x_2	{mutce}; {jdima}
karli	gismu			      	x_1 sruri x_2 gi'e clupa x_3	{sruri}; {clupa}
katna	gismu   	-ka'a-		      	x_1 noi balre ja se balre ja pilno be lo se balre cu fendi x_2 x_3	{balre}; {fendi}; {dakfu}; {jinci}
kecti	gismu   	-kec-   	-ke'i-	      	x_1 sarxe ja xendo cinmo lo ka badri lo nu x_2 malfri ja malselfu'a x_3	{sarxe}; {xendo}; {cinmo}; {badri}; {malfri}; {malselfu'a}
kelci	gismu   	-kel-   	-kei-	      	x_1 se zdile ja xalbo lo ka zukte tu'a x_2	{zdile}; {xalbo}; {zukte}
kelvo	gismu   	-ke'o-		      	x_1 klani x_2 lo sornai rauci'e ni glare	{klani}; {sornai}; {rauci'e}; {glare}; {jacke'o}
kenra	gismu   	-ken-		      	x_1 te bilma fi x_2 fe lo xlali je gunta nu lo selci cu trocau lo ka banro	{bilma} .i {xlali} .i {gunta} .i {selci} .i {trocau} .i {banro}
kensa	gismu   	-kes-		      	x_1 canlu zi'o gi'e sruri ja jibni ja ckini x_2 noi tarci gi'a plini gi'a ragve lo vacri be lo terdi	{canlu}; {sruri}; {jibni}; {ckini}; {tarci}; {plini}; {ragve}; {vacri}; {terdi}
kerfa	gismu   	-kre-		      	x_1 cinla cilta lo lanbi gi'e se jinto fi lo pilka be x_2	{cinla}; {cilta}; {lanbi}; {jinto}; {pilka}; {sunla}
kevna	gismu   	-kev-   	-ke'a-	      	x_1 kunti pagbu be x_2	{kunti}; {pagbu}
kibro	experimental gismu			      	x_1 ckini lo kulnu ja cecmu ja tutci pe lo munje se tcana be lo skami x_2	{ckini}; {kulnu}; {cecmu}; {tutci}; {munje}; {tcana}; {skami}
kijno	gismu   	-kij-		      	x_1 skacau je pancau gapci cmuxu'i gi'e ji'i fi'u mu si'e lo vacri be lo terdi gi'e se sinxa zo'oi O	{skacau}; {pancau}; {gapci}; {cmuxu'i}; {vacri}; {sinxa}
kilto	gismu   	-ki'o-		      	x_1 klani li gei ci x_2	{klani}; {centi}; {decti}; {dekto}; {femti}; {gigdo}; {gocti}; {gotro}; {gradu}; {megdo}; {mikri}; {milti}; {nanvi}; {petso}; {picti}; {terto}; {xatsi}; {xecto}; {xexso}; {zepti}; {zetro}
kisto	gismu   	-kis-		      	x_1 ckini lo kulnu ja bangu ja cecmu ja natmi pe lo gugdepuku x_2	{kulnu}; {bangu}; {cecmu}; {natmi}; {gugdepuku}; {xurdo}; {banpu'anu}; {xazdo}
klaku	gismu   	-kak-		      	x_1 se cliva x_2 noi silna litki se cigla lo kanla ku'o se ja'e lo nu x_1 badri x_3 ja carmi lo ka cinmo x_3	{cliva}; {silna}; {litki}; {cigla}; {kanla}; {badri}; {carmi}; {cinmo}
klama	gismu   	-kla-		      	lo ka klama cu ka ce'u goi x_1 zukte lo ka ce'u muvdu ce'u xi re goi x_2 ce'u xi re goi x_3 ce'u xi re goi x_4 fi'o marce ce'u xi re goi x_5	.i lo ka klama cu ka zukte kei joi ka muvdu .ibo ku'i srana lo marce .i ji'a lo klama cu litru .ibo si'a lo ve klama fa'u lo xe klama cu se litru fa'u te litru .i ro da poi cmima lo'i lo'u {cadzu} {bajra} {marce} {vofli} {litru} {muvdu} {cpare} {pluta} {bevri} {farlu} {limna} {vitke} {ka'a} le'u zo'u .e'u catlu zo'e ne da 
klani	gismu   	-lai-		      	x_1 se parbi x_2 noi namcu ku'o lo gradu be x_3	{parbi}, {namcu}, {gradu}
klesi	gismu   	-kle-   	-lei-	      	x_1 menre x_2 gi'e se kampu x_3 noi steci x_1 x_2 .i x_1 gunma lo ro cmima be x_2 poi ckaji x_3	{menre}; {kampu}; {steci}; {gunma}; {cmima}; {ckaji}; {jutsi}
klina	gismu   	-kli-		      	lo nu x_2 pagre x_1 cu cumki gi'e na rinka lo nu x_2 preja .i x_1 ka'e se pagre x_2 noi ke'a gusni ja se cradi ja glaseldi'e ja dicmaksybo'a	srana fa zo {zunti} .e zo {pagre} .e zo {muvdu} .e zo {benji} .e zo {gusni}
kluza	gismu   	-luz-		      	x_1 na'e mutce lo ka mapti x_2 x_3 kei ja'e lo nu x_1 na'e danre x_2 gi'a ne'e rinju gi'a na jai nandu fai lo ka se muvgau .i x_1 to'e tagji x_2 x_3	{mutce}; {mapti}; {danre}; {rinju}; {nandu}; {muvgau}; {tagji}
kojna	gismu   	-koj-   	-ko'a-	      	x_1 pagbu x_2 gi'e jibni lo jipno be x_2 gi'e marji x_3 .i x_1 jbini lo linji ja seffta poi kucysi'u ku'o gi'e jibni lo se kucysi'u 	{pagbu}; {jipno}; {jibni}; {marji}; {linji}; {sefta}; {kucysi'u}
kolme	gismu   	-kol-   	-ko'e-	      	x_1 xekri ja manbu'e ke jelka'e kunra x_2 noi ba'o jalge spati	{xekri}; {manbu'e}; {jelka'e}; {kunra}; {jalge}; {spati}
konju	gismu   	-kon-   	-ko'u-	      	x_1 se sefta lo gunma be lo linji be lo mokca jo'u lo plita kruli'i poi na se vasru my zi'e noi mu'a cukla ku'o gi'e marji x_2	{sefta}; {gunma}; {linji}; {mokca}; {plita}; {kruli'i}; {vasru}; {cukla}; {marji}
korbi	gismu   	-kor-   	-koi-	      	x_1 pagbu je fanmo x_2 gi'e jimte x_2 lo ka kuspe kei gi'e te sepli x_2 x_3	{pagbu}; {fanmo}; {jimte}; {kuspe}; {sepli}
korcu	gismu   	-kro-		      	x_1 na'e sirji	{sirji}
kosta	gismu   	-kos-		      	x_1 taxfu fi lo ka gacri ja bartu lo drata taxfu kei gi'e marji x_2	{taxfu} .i {gacri} .i {bartu} .i {marji}
krasi	gismu   	-kra-		      	x_1 pagbu ja te farvi x_2 gi'e purci ja se jersi ja lidne ro drata pagbu be x_2 .i x_1 to'e fanmo x_2	{pagbu}; {farvi}; {purci}; {jersi}; {lidne}; {drata}; {fanmo}; {cfari}; {mulno}; {traji}
krati	gismu   	-ka'i-		      	x_1 ckaji ja zukte x_3 noi nu'o se ckaji ja se zukte x_2	{ckaji}; {zukte}; {basti}; {jansu}; {vipsi}
krefu	gismu   	-ref-   	-ke'u-	      	x_3 kaidza lo ka ce'u nundumu x_2 gi'e fasnu gi'e purci x_1 noi nundumu x_2 gi'e fasnu .i va'i x_1 momkai x_3 lo ro nundumu be x_2 lo ka ce'u ce'u se tcika	srana fa zo {rapli}
krici	gismu   	-kri-		      	x_1 pensi lo du'u x_2 noi srana x_3 cu jetnu kei gi'e na pensi lo du'u x_2 ka'e na jetnu	{pensi}; {srana}; {jetnu}; {jinvi}; {birti}; {djuno}; {senpi}; {lijda}
krili	gismu			      	x_1 sligu dacti gi'e se sefta lo plita gi'e marji x_2 noi se stura x_3	{sligu}; {dacti}; {sefta}; {plita}; {marji}; {stura}
krinu	gismu   	-rin-   	-ki'u-	      	x_1 jicmu ja velcki lo du'u x_2 jalge ma kau	{jicmu}; {velcki}; {jalge}; {rinka}; {nibli}; {mukti}; {zukte}; {bapli}
krixa	gismu   	-kix-   	-ki'a-	      	x_1 bacru x_2 noi cladu	{cladu}; {bacru}
kruji	gismu   	-ruj-		      	x_1 xutla pesxu ja ke ranti sligu ja ke jdari litki x_2	{xutla} .i {pesxu} .i {ranti} .i {sligu} .i {jdari} .i {litki} .i {marji}
kubli	gismu   	-kub-		      	x_1 se sefta xa kurfa noi ro ke'a cu sraji ro lamji sefta	{sefta}; {kurfa}; {sraji}; {lamji}
kucli	gismu			      	x_1 djica lo nu x_1 djuno lo du'u x_2 makau brije'u	srana fa zo {brije'u} .e zo {brije'uju'o} .e zo {brireisku}
kukte	gismu   	-kuk-		      	lo nu x_1 ganse x_2 cu pluka x_1	{pencu}; {sanji}; {viska}; {sumne}; {tirna}; {zgana}; {vrusi}
kulnu	gismu   	-klu-		      	x_1 gunma lo sidbo jo'u tcaci jo'u se larcu jo'u larcu pe x_2 noi natmi ja cecmu	{gunma}; {sidbo}; {tcaci}; {larcu}; {natmi}; {cecmu}
kumfa	gismu   	-kum-   	-ku'a-	      	x_1 pagbu x_2 noi dinju ja stura ku'o gi'e se sruri x_3 noi bitmu ja loldi ja drudi	{pagbu}; {dinju}; {stura}; {sruri}; {bitmu}; {loldi}; {drudi}
kumte	gismu			      	x_1 rapmarxa mabru x_2 noi jutsi la'o lanzu Camelidae lanzu	{rapmarxa}; {mabru}; {jutsi}; {lanme}; {bakni}; {kanba}; {mirli}; {djirafa}
kunra	gismu   	-kun-		      	x_1 rarna je na'e jmive je sligu marji x_2	{rarna}; {jmive}; {sligu}; {marji}
kunti	gismu   	-kut-		      	x_1 claxu lo ka ce'u vasru x_2 .i x_1 ka'e je nai ca'a vasru x_2 .i x_1 to'e culno x_2	{vasru}; {claxu}; {culno}
kurji	gismu   	-kuj-   	-ku'i-	      	x_1 stagau x_2 lo ka snura ja kanro ja kufra ja cnici ja tolpo'u ja drani ja zanseltcini	{stagau}; {snura}; {kanro}; {kufra}; {cnici}; {tolpo'u}; {zanseltcini}
kurki	gismu			      	x_1 se vrusi lo ka tolpu'a ja cpina x_2	{vrusi}; {tolpu'a}; {cpina}; {titla}; {slari}; {silnycpina}; {krumami}
kuspe	gismu   	-kup-   	-ku'e-	      	x_1 se canlu ja se ditcu x_2 .i x_2 ro mei lo na'e bancu be lo jimte be x_1	{canlu}; {ditcu}; {bancu}; {jimte}; {ranji}; {renvi}; {tcena}; {preja}
kusru	gismu   	-kus-		      	x_1 to'e xendo x_2	{xendo} .i {palci}
lacpu	gismu   	-lap-   	-cpu-	      	x_1 danre x_2 lo ka muvdu fa'a x_1 .i x_1 to'e catke x_2	{danre}; {muvdu}; {fa'a}; {catke}
ladru	gismu   	-lad-		      	x_1 blabi litki gi'e se cigla fi x_2 noi fetsi mabru ku'o gi'e cidja lo cifnu be x_2	{blabi}; {litki}; {cigla}; {fetsi}; {mabru}; {cidja}; {cifnu}
lakne	gismu   	-la'e-		      	x_1 cumki x_2 .i je va'o x_2 lo du'u x_1 ja'a fasnu cu zmadu lo du'u x_1 na fasnu kei lo ni se kanpe gi'a simlu lo ka jetnu .i x_1 pi so'i cu'o x_2	{cumki}; {fasnu}; {zmadu}; {kanpe}; {simlu}; {jetnu}; {cu'o}
laldo	experimental gismu			      	x_1 clani lo ka ma kau temci lo nu ce'u jbena kei lo cabna .i x_1 to'e citno	{clani}; {temci}; {jbena}; {cabna}; {citno}
lamji	gismu   	-lam-   	-la'i-	      	da de poi dubmau ja dubme'a da li pa zo'u ge x_1 da x_3 pormoi gi x_2 de x_3 pormoi	srana fa zo {pormoi} .e zo {lidne} .e zo {li'erla'i}
lanbi	gismu			      	x_1 jmive xumsle gi'e se gunma lo barda pagbu be lo jmive gi'e sarcu cidja lo danlu	{jmive}; {xumsle}; {gunma}; {barda}; {pagbu}; {sarcu}; {cidja}; {danlu}
lanka	gismu			      	x_1 vautci x_2 gi'e ba'o se jivbu fi x_3	{vautci}; {jivbu}
lanli	gismu   	-lal-		      	x_1 zgana lo tcila be x_2 ta'i x_3	{zgana} .i {tcila}
lanme	gismu   	-lan-		      	x_1 rapmarxa mabru x_2 noi jutsi la'o jutygunma Ovis jutygunma	{rapmarxa}; {mabru}; {jutsi}; {kanba}; {bakni}; {kumte}; {mirli}; {djirafa}
lante	gismu			      	x_1 tagji ganlo vautci x_2 gi'e marji x_3 gi'e na'o slanu
lanxe	gismu   	-lax-		      	x_1 se danre x_2 noi prosi'u gi'e bapli no da	{danre}; {prosi'u}; {bapli}
lanzu	gismu   	-laz-		      	x_1 gunma lo kansi'u be lo ka xabju je jmive be'o noi ke'a se menre x_2 je noi ke'a ckinysi'u x_3	srana fa zo {bende} .e zo {natmi} .e zo {cmima} .e zo {jutsi} .e zo {prenu} .e zo {mamta} .e zo {patfu} .e zo {rirni} .e zo {tunba} .e zo {klesi}
lasna	gismu   	-la'a-		      	x_1 gasnu lo nu x_2 jorne x_3 kei se pi'o x_4	{gasnu}; {jorne}; {pilno}; {jongau}
lastu	gismu			      	x_1 jinme x_2 noi se ralju lo mixre be lo tunka jo'u lo zinki	{jinme}; {mixre}; {tunka}; {zinki}; {ransu}
latmo	gismu   	-la'o-		      	x_1 ckini lo kulnu ja bangu ja cecmu ja natmi pe lo banlu'atu x_2	{kulnu}; {bangu}; {cecmu}; {natmi}; {banlu'atu}; {ropno}; {fraso}; {porto}; {spano}; {xispo}
lazni	gismu			      	x_1 se tcaci lo ka rivbi lo ka gunka ja tolsurla x_2	{tcaci}; {rivbi}; {gunka}; {tolsurla}; {surla}
lebna	gismu   	-leb-   	-le'a-	      	x_1 gasnu lo nu x_2 sisti lo nu x_2 zvati x_3 i x_1 gasnu lo nu ge x_1 co'a ponse x_2  gi x_3 co'u ponse x_2	{vimcu}, {cpacu}
lenjo	gismu   	-len-   	-le'o-	      	x_1 klina x_2 noi mu'a gusni kei gi'e se sefta lo kruvi ja'e lo nu gasnu lo nu x_2 jmaji x_3 kei kei gi'e marji x_4	{klina}; {gusni}; {sefta}; {kruvi}; {gasnu}; {jmaji}; {marji}
lenku	gismu   	-lek-		      	x_1 to'e glare	{glare}; {bisli}; {snime}; {dunja}; {dunra}
lerci	gismu   	-lec-		      	x_1 cabna ja balvi lo fanmo be lo tcaci ja se kanpe temci .i x_1 to'e clira	{cabna}; {balvi}; {fanmo}; {tcaci}; {kanpe}; {temci}; {clira}
lerfu	gismu   	-ler-   	-le'u-	      	x_1 selci lo'e sinxa gi'e cmima x_2 gi'e sinxa x_3	{sinxa} {selci}; {abu}, {by}, {cy}, {dy}, {ebu}, {fy}, {gy}, {ibu}, {jy}, {ky}, {ly}, {my}, {ny}, {obu}, {py}, {ry}, {sy}, {ty}, {ubu}, {vy}, {xy}, {ybu}, {zy}, {y'y}; {ga'e}, {to'a}, {lo'a}, {ge'o}, {je'o}, {jo'o}, {ru'o}, {se'e}, {na'a}; {tau}, {zai}, {ce'a}, {lau}; {tei}, {foi}
libjo	gismu   	-lib-		      	x_1 ckini lo kulnu ja bangu ja cecmu ja natmi pe lo gugdeluje x_2	{kulnu}; {bangu}; {cecmu}; {natmi}; {gugdeluje}; {friko}; {xrabo}
lidne	gismu   	-li'e-		      	da de poi dubmau da zo'u ge x_1 pormoi da x_3 gi x_2 pormoi de x_3	srana fa zo {pormoi} .e zo {lamji} .e zo {li'erla'i}
lifri	gismu   	-lif-   	-fri-	      	x_1 pagbu je renvi x_2 noi fasnu	{pagbu} .i {renvi} .i {fasnu}
limna	gismu   	-lim-		      	x_1 fulta gi'e sezu'e muvdu vau x_2
lindi	gismu   	-lid-		      	x_1 dikca bargu gi'e kuspe x_2 se bi'o x_3	{dikca}; {bargu}; {kuspe}
linji	gismu   	-lij-   	-li'i-	      	x_1 se cimde pa da gi'e se cmima x_2 noi mokca
lisri	gismu   	-lis-		      	x_1 ve skicu x_2 noi porsi lo fasnu ku'o fo x_3 fi x_4	{skicu}; {porsi}; {fasnu}
liste	gismu   	-ste-		      	x_1 vreji lo porsi be x_2 bei x_3 x_4	{vreji}; {porsi}
litki	gismu   	-lik-		      	x_1 marji x_2 noi lo selci be ke'a cu zifre lo ka ce'u muvdu fo lo jbini be ce'u kei gi'e ku'i na sepsimyze'a .i x_1 na'e sligu je na'e gapci x_2	{marji}; {selci}; {zifre}; {muvdu}; {jbini}; {sepsimyze'a}; {sligu}; {gapci}
litru	gismu   	-li'u-		      	x_1 pilno fe'e ca'o x_2 boi x_3 lo nu x_1 cenba lo ka ce'u zvati makau i x_1 klama zi'o zi'o x_2 boi x_3
livla	gismu   	-lil-		      	x_1 sabji lo nejni x_2	{sabji}; {nejni}
logji	gismu   	-loj-		      	x_1 javni lo du'u ma kau tadji lo nu pensi x_2	{pensi}; {tadji}; {javni}; {nibli}
loglo	experimental gismu			      	x_1 ckini lo kulnu ja bangu ja cecmu pe la .loglan. x2	{ckini}; {kulnu}; {bangu}; {cecmu}
lojbo	gismu   	-lob-   	-jbo-	      	x_1 ckini lo kulnu ja bangu ja cecmu pe la .lojban. x2	{ckini}; {kulnu}; {bangu}; {cecmu}
loldi	gismu   	-lol-   	-loi-	      	x_1 cnita je plita pagbu x_2 gi'e ka'e sarji ja se cpana .i x_1 to'e drudi x_2	{cnita}; {plita}; {pagbu}; {sarji}; {cpana}; {drudi}; {kumfa}; {bitmu}; {vorme}; {canko}
lorxu	gismu   	-lor-   	-lo'u-	      	x_1 re'ucti mabru x_2 noi jutsi la'o jutsi. Vulpes .jutsi 	srana fa zo {gerku} .e zo {labno} .e zo {mabru} .e zo {re'ucti}
lubno	gismu   	-lu'o-		      	x_1 ckini lo kulnu ja bangu ja cecmu ja natmi pe lo gugdelubu x_2	{kulnu}; {bangu}; {cecmu}; {natmi}; {gugdelubu}; {xazdo}; {semto}; {xrabo}
lujvo	gismu   	-luv-   	-jvo-	      	x_1 selbri za'upamei valsi x_2 gi'e se sumti x_3 gi'e se zbasu fi x_4 poi tanru	.i ko viska zo {stura} .e zo {cmavo} .e zo {gismu} .e zo {rafsi} .e zo {smuni} ji'a
lumci	gismu   	-lum-   	-lu'i-	      	x_1 gasnu lo nu x_2 jinsa x_3	{gasnu}; {jinsa}
lunbe	gismu   	-lub-		      	x_1 dasni no da .i x_1 se gacri no da	srana fa zo {taxfu} .e zo {dasni} .e zo {bandu}
lunra	gismu   	-lur-		      	x_1 mluni x_2 noi plini gi'e na'o terdi	{mluni}; {plini}; {terdi}; {solri}
lunsa	gismu   	-lus-		      	x_1 noi gapci cu binxo lo litki	{gapci}; {litki}; {dunja}; {febvi}; {runme}
mabla	gismu   	-mal-		      	x_1 xlali ja rigni ja fegli ja to'e pluka ja na'e mansa fi x_2 fe x_3 .i x_1 to'e zabna x_2 x_3	{xlali}; {rigni}; {fegli}; {pluka}; {mansa}; {zabna}
mabru	gismu   	-mab-		      	x_1 bogda'u x_2 .i lo xadni be x_1 cu na'o se gacri lo kerfa .i x_1 ctigau lo cifnu lo ladru noi se cigla lo tatru	{bogda'u}; {danlu}; {tatru}; {cigla}; {ladru}
makfa	gismu   	-maf-		      	x_1 zdile ja spaji ja se manci tcica x_2 gau x_3 .i x_1 noi na'e rarna cu se ganse ja se lifri x_2 gau x_3	{zdile}; {spaji}; {manci}; {tcica}; {rarna}; {ganse}; {lifri}; {gasnu}
mamta	gismu   	-mam-		      	x_1 fetsi gi'e rirni x_2
manci	gismu   	-mac-		      	x_1 cinmo lo ka sinma x_2 gi'e dusfri x_2 lo ka banli	{cinmo}; {sinma}; {dusfri}; {banli}; {u'e}
manfo	gismu			      	x_1 ckaji x_2 ije ro pagbu be x_1 cu dunli x_1 boi x_2 i x_1 to'e vrici x_2	{dunli}, {vrici}
manku	gismu   	-man-		      	x_1 toltce ja claxu lo ka se gusni 	{toltce}, {claxu}, {gusni}
manri	gismu   	-mar-		      	x_1 ciste lo sidbo ja tcaci ja javni ja marde lo ka se pilno fi lo ka ganse ja pajni x_2	{ciste}; {sidbo}; {tcaci}; {javni}; {marde}; {pilno}; {ganse}; {pajni}; {greku}
mansa	gismu			      	x_1 mulno lo ka mapti lo se djica ja se denpa ja se nitcu ja se cpedu be x_2 bei x_3	{mulno}; {mapti}; {djica}; {denpa}; {nitcu}; {cpedu}
manti	gismu			      	x_1 xekri ja xunre ja bunre ja pelxu ke jiksi'u cinki x_2 noi jutsi la'o lanzu Formicidae lanzu	{jiksi'u}; {cinki}
mapti	gismu   	-mat-		      	x_1 ckini x_2 x_3 ja'e lo drani ja mansa ja se djica	{ckini}; {drani}; {mansa}; {djica}; {sarxe}; {tugni}; {satci}; {tarmi}; {mintu}
marce	gismu   	-ma'e-		      	x_1 tutci lo ka bevri x_2 fu x_3 gi'a te litru x_3 x_2 kei gi'e se muvgau x_4	{tutci}; {bevri}; {litru}; {muvgau}
marde	gismu   	-mad-		      	x_1 manri lo du'u x_2 ma kau vrude .e lo du'u x_2 ma kau palci 	{manri}; {vrude}; {palci}
