bacru	gismu   	-ba'u-		      	x_1 pronuncia/dice/verbaliza/vocaliza/hace sonido x_2	Ver también {krixa},  {cusku}.
badna	gismu			      	x_1 es una banana/plátano (fruta) de especie/variedad x_2
badri	gismu   	-dri-		      	x_1 está triste/deprimido/melancólico por x_2 (evento)	Ver también {gleki}.
bajra	gismu   	-baj-		      	x_1 corre sobre superficie x_2 usando miembros x_3 con paso x_4	Ver también {cadzu},  {klama},  {litru},  {stapa}.
bakfu	gismu   	-baf-		      	x_1 es un paquete/bulto/montón de x_2, atado/sostenido por x_3
bakni	gismu   	-bak-		      	x_1 es una vaca/toro/ganado/vacuno/buey de especie/raza x_2
bakri	gismu			      	x_1 es una cantidad de tiza/yeso/creta/marga de origen x_2 en forma x_3
baktu	gismu			      	x_1 es un balde/cubo/tarro/tonel/lata/tinaja/recipiente de boca ancha para contenido x_2, de material x_3	Ver también {botpi},  {patxu},  {tansi}.
balji	gismu			      	x_1 es un bulbo de planta/especie x_2	Ver también {punli}.
balni	gismu			      	x_1 es un balcón/cornisa/estante de edificio/estructura x_2	Ver también {kajna}.
balre	gismu   	-ba'e-		      	x_1 es una hoja de herramienta/arma x_2	Ver también {dakfu}.
balvi	gismu   	-bav-		      	x_1 está en el futuro/luego/más tarde/después/posterior en el tiempo a x_2	Ver también {purci},  {cabna},  {jersi}.
bancu	gismu   	-bac-		      	x_1 excede/sobrepasa/está más allá de/pasando x_2 desde x_3 en propiedad/cantidad x_4	Ver también {dukse},  {ragve}.
bandu	gismu   	-bad-		      	x_1 (evento) defiende/protege/ampara a x_2 de amenaza/peligro potencial x_3 (evento)
banfi	gismu			      	x_1 es un anfibio de especie/raza x_2
bangu	gismu   	-ban-   	-bau-	      	x_1 es un idioma/dialecto/lengua/lenguaje de gente/pueblo/hablante x_2 usado para comunicar x_3
banli	gismu   	-bal-   	-ba'i-	      	x_1 es grandioso en propiedad x_2 según estándar x_3	Ver también {barda},  {nobli},  se {sinma},  {pluja}.
banro	gismu   	-ba'o-		      	x_1 crece/brota/se expande/se desarrolla a tamaño/forma x_2 desde x_3	Ver también {preja},  {farvi},  {zenba}.
banxa	gismu   	-bax-		      	x_1 es un banco propiedad de/en sistema bancario x_2 con funciones x_3 (evento)]
banzu	gismu   	-baz-		      	x_1 alcanza/basta/es suficiente para propósito x_2 bajo condiciones x_3	Ver también {sarcu},  {dukse},  {claxu},  {nitcu}.
bapli	gismu   	-bap-   	-bai-	      	x_1 (evento) fuerza/obliga/compele a que x_2 ocurra	Ver también {jitro},  {rinka},  {krinu},  {zukte}.
barda	gismu   	-bra-		      	x_1 es grande/amplio en propiedad/dimensión x_2 comparado con estándar/norma x_3	Ver también {cmalu}.
bargu	gismu   	-bag-		      	x_1 es un arco/curva sobre x_2 hecho de material x_3
barja	gismu			      	x_1 es una taberna/bar en localidad x_2 que sirve x_3 a clientes x_4	Ver también {gusta}.
barna	gismu   	-ba'a-		      	x_1 es una marca sobre x_2 de material x_3
bartu	gismu   	-bar-		      	x_1 está afuera/exterior/externo/fuera de x_2	Ver también {nenri}.
basna	gismu			      	x_1 enfatiza/acentúa x_2 con acción/énfasis x_3
basti	gismu   	-bas-		      	x_1 reemplaza/sustituye/toma el lugar de x_2 en circunstancia x_3
batci	gismu   	-bat-		      	x_1 muerde/pellizca a x_2 en x_3 con x_4
batke	gismu			      	x_1 es un botón/perilla/manija/tirador en x_2, con propósito x_3, hecho de material x_4
bavmi	gismu			      	x_1 es una cantidad de cebada (grano) de especie/variedad x_2
baxso	gismu			      	x_1 refleja cultura/nacionalidad/idioma bahasa (malayo-indonesio) en aspecto x_2	Ver también {meljo},  {bindo}.
bebna	gismu   	-beb-		      	x_1 es tonto/bobo/idiota/estúpido sobre asunto x_2	Ver también {prije}.
bemro	gismu   	-bem-   	-be'o-	      	x_1 refleja cultura/nacionalidad/geografía centro/norteamericana en aspecto x_2
bende	gismu   	-bed-   	-be'e-	      	x_1 es un equipo/escuadrón/banda/orquesta de personas x_2 dirigidos/conducidos por x_3 organizados con propósito x_4
bengo	gismu   	-beg-		      	x_1 refleja cultura/nacionalidad/idioma bengalí en aspecto x_2
benji	gismu   	-bej-   	-be'i-	      	x_1 transfiere/manda/transmite/envía x_2 a receptor x_3 desde transmisor/origen x_4 por medio x_5	Ver también {mrilu}.
bersa	gismu   	-bes-   	-be'a-	      	x_1 es hijo (varón) de madre/padre x_2 (no necesariamente biológico)	Ver también {panzi},  {tixnu}.
berti	gismu   	-ber-		      	x_1 está al norte/septentrional de x_2 según marco de referencia x_3	Ver también {snanu},  {stuna},  {stici}.
besna	gismu   	-ben-		      	x_1 es un cerebro/seso (parte del cuerpo) de x_2
betfu	gismu   	-bef-   	-be'u-	      	x_1 es un abdomen/panza/barriga/vientre (parte del cuerpo) de x_2	Ver también {canti}.
betri	gismu   	-bet-		      	x_1 (evento) es una tragedia/desastre/trágico para x_2
bevri	gismu   	-bev-   	-bei-	      	x_1 lleva/traslada/carga/transporta x_2 hasta x_3 desde x_4 por camino x_5
bidju	gismu			      	x_1 es un abalorio/canica/bolita (forma) de material x_2
bifce	gismu   	-bic-		      	x_1 es una abeja/avispa de especie/raza x_2
bikla	gismu   	-bik-		      	x_1 es un látigo/latiguea (movimiento rápido y violento)
bilga	gismu   	-big-		      	x_1 está obligado a/debe/tiene que ser/hacer x_2 (evento) según estándar/acuerdo/marco x_3	Ver también {zifre}.
bilma	gismu   	-bi'a-		      	x_1 está enfermo con síntomas x_2 de enfermedad/mal x_3
bilni	gismu   	-bil-		      	x_1 es militar/regimentado/organizado por sistema x_2 con propósito x_3
bindo	gismu   	-bid-		      	x_1 refleja cultura/nacionalidad/idioma indonesio en aspecto x_2
binra	gismu			      	x_1 asegura/indemniza a x_2 contra eventualidad x_3 (evento) por monto x_4 con beneficios x_5
binxo	gismu   	-bix-   	-bi'o-	      	x_1 se hace/vuelve/convierte/transforma en x_2 bajo condiciones x_3	Ver también {cenba},  {galfi},  {stika},  {zasni}.
birje	gismu			      	x_1 es una cantidad de cerveza de origen x_2
birka	gismu   	-bir-		      	x_1 es un brazo (parte del cuerpo) de x_2
birti	gismu   	-bit-		      	x_1 está seguro/tiene la certeza/está convencido de que x_2 (du'u) es cierto
bisli	gismu   	-bis-		      	x_1 es una cantidad de hielo de material/composición x_2
bitmu	gismu   	-bim-   	-bi'u-	      	x_1 es una pared/muro/verja/valla que separa x_2 y x_3 en estructura x_4	Ver también {vorme},  {jbini},  {sepli}.
blabi	gismu   	-lab-		      	x_1 es blanco/muy claro (color)
blaci	gismu			      	x_1 es una cantidad de vidrio de composición x_2
blanu	gismu   	-bla-		      	x_1 es azul (color)
bliku	gismu   	-bli-		      	x_1 es un bloque/ladrillo de material x_2 con superficies/lados x_3
bloti	gismu   	-lot-   	-blo-   	-lo'i-      	x_1 es un bote/barco/embarcación/navío/nave (vehículo) para pasajeros/carga x_2, propelido/impulsado por x_3
bolci	gismu   	-bol-   	-boi-	      	x_1 es una pelota/bola/esfera/globo (forma) de material x_2
bongu	gismu   	-bog-   	-bo'u-	      	x_1 es un hueso/marfil (parte del cuerpo) que realiza función x_2 en el cuerpo de x_3
botpi	gismu   	-bot-   	-bo'i-	      	x_1 es una botella/jarro/urna/recipiente tapable para contenido x_2, de material x_3, con tapa x_4	Ver también {baktu}.
boxfo	gismu   	-bof-   	-bo'o-	      	x_1 es una hoja/lámina/plancha (forma bidimensional flexible) de material x_2	Ver también {bukpu}.
boxna	gismu   	-bon-   	-bo'a-	      	x_1 es una onda/ola (forma periódica) en medio x_2, forma de onda x_3, longitud de onda x_4, frecuencia x_5
bradi	gismu			      	x_1 es un enemigo/oponente/contendiente/adversario/antagonista de x_2 en lucha x_3	Ver también {damba},  {jamna}.
bratu	gismu			      	x_1 es una cantidad de granizo/pedrisco/precipitación sólida de material/composición x_2
brazo	gismu   	-raz-		      	x_1 refleja cultura/nacionalidad/idioma brasileño en aspecto x_2
bredi	gismu   	-red-   	-bre-	      	x_1 está listo/preparado/dispuesto para x_2 (evento)
bridi	gismu   	-bri-		      	x_1 es un predicado con relación x_2 entre argumentos x_3
brife	gismu   	-bif-   	-bi'e-	      	x_1 es una brisa/viento/vendaval desde dirección x_2 con velocidad x_3
briju	gismu   	-bij-		      	x_1 es una oficina/lugar de trabajo de x_2 en localidad x_3
brito	gismu   	-rit-		      	x_1 refleja cultura/nacionalidad/idioma británico/del Reino Unido en aspecto x_2	Ver también {glico},  {skoto},  {merko}.
broda	gismu   	-rod-		      	1er predicado variable asignable
brode	gismu   	-bo'e-		      	2do predicado variable asignable
brodi	gismu			      	3er predicado variable asignable
brodo	gismu			      	4to predicado variable asignable
brodu	gismu			      	5to predicado variable asignable
bruna	gismu   	-bun-   	-bu'a-	      	x_1 es hermano (varón) de x_2 por lazo/relación x_3 (no necesariamente biológica)	Ver también {mensi},  {tunba},  {tamne}.
budjo	gismu   	-buj-   	-bu'o-	      	x_1 refleja cultura/religión/ética budista en aspecto x_2
bukpu	gismu   	-buk-   	-bu'u-	      	x_1 es una tela/paño/género/sábana (forma flexible bidimensional) de tipo/material x_2	Ver también {boxfo}.
bumru	gismu   	-bum-		      	x_1 es brumoso/cubierto de niebla/neblina/rocío/vapor de líquido x_2
bunda	gismu   	-bud-		      	x_1 pesa x_2 unidades locales de peso (1 por defecto), estándar x_3, x_4 subunidades
bunre	gismu   	-bur-   	-bu'e-	      	x_1 es marrón/castaño/canela/pardo (color)
burcu	gismu   	-bru-		      	x_1 es un cepillo/brocha con propósito x_2 con hebras x_3	Ver también {komcu}.
burna	gismu			      	x_1 se siente incómodo/embarazado/desconcertado/turbado por x_2 (evento)	Ver también {kufra}.
cabna	gismu   	-cab-		      	x_1 está en el presente/durante/simultáneo/al mismo tiempo que x_2	Ver también {balvi},  {purci},  {zvati}.
cabra	gismu   	-ca'a-		      	x_1 es un aparato/mecanismo/artefacto/ingenio con función x_2 controlado por x_3	Ver también {tutci},  {minji}.
cacra	gismu			      	x_1 dura x_2 horas (1 por defecto) según estándar x_3
cadzu	gismu   	-dzu-		      	x_1 anda/camina/pasea sobre superficie x_2 usando miembros x_3	Ver también {stapa},  {bajra},  {klama},  {litru}.
cafne	gismu   	-caf-		      	x_1 (evento) ocurre frecuentemente/seguido/a menudo según estándar x_2	Ver también {rirci},  {fadni},  {kampu},  {rapli},  {krefu}.
cakla	gismu			      	x_1 es una cantidad de chocolate/cacao
calku	gismu   	-cak-		      	x_1 es una concha/casco/casquete/caparazón/cubierta protectora alrededor de x_2 compuesta de x_3	Ver también {pilka},  {skapi}.
canci	gismu			      	x_1 desaparece/se desvanece de localidad x_2	Ver también {stali}.
cando	gismu   	-cad-		      	x_1 está quieto/inactivo/en reposo/inmóvil/ocioso	Ver también {muvdu}.
cange	gismu   	-cag-		      	x_1 es una granja/chacra/rancho/estancia en x_2, trabajada por x_3, con producción x_4	Ver también {purdi}.
canja	gismu   	-caj-		      	x_1 canjea/intercambia x_2 por x_3 con x_4
canko	gismu   	-ca'o-		      	x_1 es una ventana/apertura en pared/edificio/estructura x_2	Ver también {vorme}.
canlu	gismu   	-cal-   	-ca'u-	      	x_1 es espacio/volumen/lugar ocupado por x_2
canpa	gismu   	-cna-		      	x_1 es una pala para cavar x_2
canre	gismu   	-can-		      	x_1 es una cantidad de arena de origen x_2 de composición x_3
canti	gismu			      	x_1 son entrañas/intestinos/tripas/sistema digestivo (parte del cuerpo) de x_2
carce	gismu			      	x_1 es un carro/carroza/carruaje/carreta/vagón (vehículo con ruedas) para pasajeros/carga x_2, propelido/impulsado por x_3
carmi	gismu   	-cam-   	-cai-	      	x_1 es intenso/brillante/saturado en propiedad x_2 según observador x_3	Ver también {kandi},  {denmi}.
carna	gismu   	-car-		      	x_1 gira/rota/da vueltas alrededor de eje x_2 en dirección x_3	Ver también {gunro}.
cartu	gismu   	-cat-		      	x_1 es un mapa/diagrama/carta/plano de x_2, hecho por x_3, que muestra formación/datos x_4
carvi	gismu   	-cav-		      	x_1 llueve/se precipita sobre x_2 desde x_3
casnu	gismu   	-snu-		      	x_1 discuten/hablan/conversan/charlan/dialogan/platican acerca de x_2	Ver también {tavla}.
catke	gismu   	-ca'e-		      	x_1 empuja a x_2 en parte x_3	Ver también {lacpu}.
catlu	gismu   	-cta-		      	x_1 mira/examina/inspecciona/observa/vigila x_2
catni	gismu   	-ca'i-		      	x_1 tiene autoridad/es un oficial en asunto/esfera x_2 con autoridad basada en x_3	Ver también {turni},  {tutra}.
catra	gismu			      	x_1 mata/asesina a x_2 por acción/método x_3
caxno	gismu   	-cax-		      	x_1 es poco profundo/superficial en dirección x_2 desde punto de referencia x_3 según estándar x_4	Ver también {condi},  {tordu},  {jarki},  {cinla}.
cecla	gismu   	-cel-   	-ce'a-	      	x_1 es un cañón/lanzador/pistola que dispara/lanza proyectil/misil x_2 propelido/impulsado por x_3	Ver también {renro},  {danti}.
cecmu	gismu   	-cem-   	-ce'u-	      	x_1 es una comunidad/colonia de organismos x_2
cedra	gismu			      	x_1 es una era/época/edad caracterizada por x_2	Ver también {temci},  {citsi}.
cenba	gismu   	-cne-		      	x_1 cambia/varía en propiedad x_2 en cantidad/grado x_3 bajo condiciones x_4	Ver también {jdika},  {cenba},  {binxo}.
censa	gismu   	-ces-		      	x_1 es sagrado/sacro/santo para persona/gente/cultura/religión/culto x_2	Ver también {lijda}.
centi	gismu   	-cen-		      	x_1 es un centésimo (1E-2) de x_2 en dimensión/aspecto x_3
cerda	gismu   	-ced-		      	x_1 hereda x_2 de x_3 según regla x_4
cerni	gismu   	-cer-		      	x_1 es una mañana de día x_2 en localidad x_3	Ver también {vanci},  {murse}.
certu	gismu   	-cre-		      	x_1 es un experto/profesional/sabe hacer x_2 (evento) según estándar x_3	Ver también {djuno},  {stati}.
cevni	gismu   	-cev-   	-cei-	      	x_1 es un dios/ídolo/divinidad/deidad de gente/religión x_2 con dominio sobre esfera x_3
cfari	gismu   	-cfa-		      	x_1 (evento) comienza/se inicia/empieza
cfika	gismu   	-fik-   	-fi'a-	      	x_1 es una obra de ficción sobre tema x_2 por autor x_3
cfila	gismu   	-cfi-		      	x_1 es una falla/defecto en x_2 con efecto x_3
cfine	gismu			      	x_1 es una cuña (forma) de material x_2
cfipu	gismu   	-fi'u-		      	x_1 (evento) confunde/desconcierta a x_2 por propiedad/aspecto x_3
ciblu	gismu   	-blu-		      	x_1 es sangre/fluido vital de organismo x_2
cicna	gismu			      	x_1 es cyan/turquesa/azul verdoso (color)
cidja	gismu   	-dja-		      	x_1 es comida/alimento/nutrición/sustento/comestible/nutritivo para x_2
cidni	gismu   	-cid-		      	x_1 es una rodilla/codo/nudillo/articulación (parte del cuerpo) de miembro x_2 de cuerpo x_3
cidro	gismu   	-dro-		      	x_1 es una cantidad de hidrógeno (H)
cifnu	gismu   	-cif-		      	x_1 es un infante/bebé de especie/raza x_2	Ver también {verba}.
cigla	gismu   	-cig-		      	x_1 es una glándula (parte del cuerpo) que segrega x_2, de cuerpo x_3
cikna	gismu   	-cik-		      	x_1 está despierto/alerta/consciente	Ver también {sipna},  {sanji}.
cikre	gismu			      	x_1 repara/arregla x_2 para uso x_3
ciksi	gismu   	-cki-		      	x_1 explica/aclara x_2 a x_3 con explicación x_4
cilce	gismu   	-cic-		      	x_1 es salvaje/no domesticado/silvestre
cilmo	gismu   	-cim-		      	x_1 está mojado/húmedo con líquido x_2	Ver también {sudga}.
cilre	gismu   	-cli-		      	x_1 aprende que x_2 (du'u) es cierto acerca de x_3 de origen x_4 por método/instrucción x_5	Ver también {ctuca},  {tadni},  {djuno}.
cilta	gismu   	-cil-		      	x_1 es un hilo/filamento/alambre (forma) de material x_2
cimde	gismu			      	x_1 es una dimensión de espacio/objeto x_2 según reglas/modelo x_3
cimni	gismu			      	x_1 es infinito/interminable/eterno en propiedad/dimensión x_2, en grado/tipo/cantidad x_3
cinba	gismu			      	x_1 besa a x_2 en x_3
cindu	gismu			      	x_1 es un roble (árbol) de especie/variedad x_2
cinfo	gismu			      	x_1 es un león/puma de especie/raza x_2
cinje	gismu   	-cij-		      	x_1 es una arruga/doblez en x_2	Ver también {polje}.
cinki	gismu			      	x_1 es un insecto/artrópodo de especie/variedad x_2
cinla	gismu			      	x_1 es delgado/flaco/fino/de poco espesor en dimensión/dirección x_2 (la menor) según estándar x_3	Ver también {rotsu},  {tordu},  {jarki},  {caxno}.
cinmo	gismu   	-cni-		      	x_1 siente/experimenta emoción x_2 sobre/por/hacia x_3	Ver también {ckeji},  {cortu},  {jgira},  {kecti},  {kufra},  {manci},  {prami},  {steba},  {zungi}.
cinri	gismu   	-ci'i-		      	x_1 (evento) interesa a x_2	Ver también {zdile}.
cinse	gismu   	-cin-		      	x_1 exhibe sexo/sexualidad/género/orientación sexual x_2 al hacer/ser x_3 según estándar x_4
cinta	gismu			      	x_1 es una cantidad de pintura de pigmento/substancia activa x_2, sobre una base de x_3
cinza	gismu			      	x_1 es una pinza (herramienta/parte del cuerpo) de x_2 para pellizcar x_3
cipni	gismu   	-cpi-		      	x_1 es un pájaro/ave de especie/variedad x_2
cipra	gismu   	-cip-		      	x_1 (evento) es una prueba/comprobación de x_2 (propiedad) hecha a sujeto x_3
cirko	gismu   	-cri-		      	x_1 pierde x_2 en/cerca de x_3	Ver también {penmi},  {ralte},  {sisku},  {claxu}.
cirla	gismu			      	x_1 es una cantidad de queso de origen x_2
ciska	gismu   	-ci'a-		      	x_1 escribe/inscribe x_2 en medio/superficie/documento x_3 con instrumento x_4	Ver también {tcidu},  {finti}.
cisma	gismu			      	x_1 sonríe	Ver también {cmila},  {frumu}.
ciste	gismu   	-ci'e-		      	x_1 es un sistema con función/propiedades x_2 y componentes x_3
citka	gismu   	-cti-		      	x_1 come/ingiere/consume x_2
citno	gismu   	-cit-   	-ci'o-	      	x_1 es joven según estándar x_2	Ver también {cnino},  {slabu},  {verba}.
citri	gismu   	-cir-		      	x_1 es una historia de x_2 según x_3
citsi	gismu			      	x_1 es una estación definida por propiedad x_2, de año x_3
civla	gismu   	-civ-		      	x_1 es una pulga/piojo de especie/raza x_2 parásito de x_3
cizra	gismu   	-ciz-		      	x_1 es extraño/raro/bizarro para x_2 en propiedad/aspecto x_3	Ver también {fange}.
ckabu	gismu			      	x_1 es una cantidad de goma/caucho/látex de origen x_2 de composición x_3
ckafi	gismu   	-kaf-		      	x_1 es/contiene una cantidad de café de grano/variedad/origen x_2
ckaji	gismu   	-kai-		      	x_1 tiene/presenta/manifiesta/exhibe cualidad/propiedad/rasgo/aspecto/dimensión x_2
ckana	gismu   	-cka-		      	x_1 es una cama/lecho de material x_2 para sostener/soportar a x_3 (persona/objeto/evento)	Ver también {palta},  {cpana},   {vreta},  {jubme}.
ckape	gismu   	-cap-		      	x_1 (evento) es peligroso para x_2 bajo condiciones x_3
ckasu	gismu   	-cas-		      	x_1 ridiculiza/se burla de x_2 por ser/hacer x_3 con actividad x_4
ckeji	gismu   	-kej-   	-cke-	      	x_1 siente vergu:enza/humillación/mortificación bajo condiciones x_2 ante comunidad/audiencia x_3
ckiku	gismu   	-kik-		      	x_1 es una llave de cerradura x_2 con propiedades relevantes x_3
ckilu	gismu   	-ci'u-		      	x_1 es una escala de unidades para medir/observar/determinar x_2
ckini	gismu   	-ki'i-		      	x_1 está relacionado/emparentado/pariente/tiene que ver con x_2 por relación x_3	Ver también {srana}.
ckire	gismu   	-kir-		      	x_1 agradece a x_2 por x_3
ckule	gismu   	-kul-   	-cu'e-	      	x_1 es una escuela/colegio/instituto/academia en x_2 que enseña tema x_3 ante audiencia/comunidad x_4 manejado por x_5
ckunu	gismu   	-ku'u-		      	x_1 es una conífera/pino/abeto (árbol) de especie/variedad x_2 con piñas/conos x_3
cladu	gismu   	-lau-		      	x_1 es fuerte/alto (sonido) en punto de observación x_2 según estándar x_3	Ver también {smaji},  {savru}.
clani	gismu   	-cla-		      	x_1 es largo en dimensión/dirección x_2 (la más larga) según estándar x_3	Ver también {tordu},  {ganra},  {rotsu},  {condi}.
claxu	gismu   	-cau-		      	x_1 es carece de/no tiene/está sin x_2	Ver también {nitcu},  {pindi},  {banzu}.
clika	gismu			      	x_1 es un musgo/líquen de especie/variedad x_2 que crece sobre x_3
clira	gismu   	-lir-		      	x_1 (evento) es temprano según estándar x_2	Ver también {lerci}.
clite	gismu   	-lit-		      	x_1 es cortés/amable/afable/educado en asunto x_2 según estándar/costumbre x_3
cliva	gismu   	-liv-   	-li'a-	      	x_1 deja/parte/se aleja de x_2 vía x_3
clupa	gismu   	-cup-		      	x_1 es un lazo/circuito/bucle/rizo (forma) de material x_2
cmaci	gismu			      	x_1 es una matemática de tipo x_2
cmalu	gismu   	-cma-		      	x_1 es pequeño/chico en propiedad/dimensión x_2 comparado con estándar/norma x_3	Ver también {barda}.
cmana	gismu   	-ma'a-		      	x_1 es una montaña/monte/colina/montículo/elevación/pico sobre tierra/llano x_2
cmavo	gismu   	-ma'o-		      	x_1 es una partícula/palabra estructural de tipo x_2 con significado/función x_3 en idioma x_4
cmene	gismu   	-cme-   	-me'e-	      	x_1 es un nombre/título de x_2 usado/puesto por x_3 (persona)
cmila	gismu   	-mi'a-		      	x_1 ríe	Ver también {cisma}.
cmima	gismu   	-mim-   	-cmi-	      	x_1 es un miembro/pertenece a conjunto/grupo x_2	Ver también {girzu},  {klesi}.
cmoni	gismu   	-cmo-   	-co'i-	      	x_1 gime/brama/chilla/grita/aulla/emite queja/alarido/berrido x_2 que expresa x_3
cnano	gismu   	-na'o-		      	x_1 es normal/promedio en propiedad x_2 entre x_3 según estándar x_4	Ver también {tcaci},  {fadni},  {kamtu}.
cnebo	gismu   	-neb-   	-ne'o-	      	x_1 es un cuello/cogote (parte del cuerpo) de x_2
cnemu	gismu   	-nem-   	-ne'u-	      	x_1 premia/recompensa a x_2 por acción/estado x_3 con recompensa/premio x_4	Ver también {pleji},  {sfasa}.
cnici	gismu   	-nic-		      	x_1 es pulcro/ordenado/aseado/prolijo en propiedad/aspecto x_2	Ver también {kalsa}.
cnino	gismu   	-nin-   	-ni'o-	      	x_1 es nuevo/novedoso/inaudito para x_2 en propiedad/aspecto x_3 según estándar x_4	Ver también {slabu}.
cnisa	gismu   	-nis-		      	x_1 es una cantidad de plomo (Pb)
cnita	gismu   	-nit-   	-ni'a-	      	x_1 está abajo/debajo de x_2 según marco de referencia/gravedad x_3	Ver también {gapru},  {dizlo}.
cokcu	gismu   	-cko-		      	x_1 absorbe/succiona/chupa x_2 de x_3 en x_4	Ver también {renro}.
condi	gismu   	-con-   	-cno-   	-coi-      	x_1 es hondo/profundo en dirección x_2 desde punto de referencia x_3 según estándar x_4	Ver también {caxno},  {clani},  {ganra},  {rotsu}.
cortu	gismu   	-cor-   	-cro-	      	x_1 siente dolor/le duele en parte x_2	Ver también {xrani}.
cpacu	gismu   	-cpa-		      	x_1 toma/obtiene/adquiere/recibe/consigue x_2 de x_3	Ver también {punji},  {lebna}.
cpana	gismu			      	x_1 está sobre/encima de x_2 según marco de referencia/gravedad x_3	Ver también {gapru},  {vreta}.
cpare	gismu   	-par-		      	x_1 trepa/escala/se arrastra sobre superficie x_2 en dirección x_3 usando x_4	Ver también {klama},  {litru}.
cpedu	gismu   	-cpe-		      	x_1 pide x_2 a x_3 en manera/forma x_4	Ver también {friti}.
cpina	gismu			      	x_1 es picante/sazonado/especiado al sentido x_2
cradi	gismu			      	x_1 radiotransmite x_2 por estación/emisora/frecuencia x_3 a receptor x_4
crane	gismu   	-cra-		      	x_1 está adelante/delante/frente/enfrente de x_2 que mira hacia x_3	Ver también {trixe}.
creka	gismu   	-cek-		      	x_1 es una camisa/blusa (prenda de vestir) de material x_2
crepu	gismu   	-rep-		      	x_1 cosecha/recolecta producto/objetos x_2 de origen/área x_3	Ver también {sombo},  {jmaji}.
cribe	gismu   	-rib-		      	x_1 es un oso de especie/raza x_2
crida	gismu   	-rid-		      	x_1 es un hada/duende/gnomo/elfo/trasgo de mito x_2
crino	gismu   	-ri'o-		      	x_1 es verde (color)
cripu	gismu   	-rip-		      	x_1 es un puente sobre/a través de x_2 entre x_3 y x_4
crisa	gismu   	-cis-		      	x_1 es el verano/estío/estación cálida del año x_2 en localidad x_3	Ver también {critu},  {dunra},  {vensa}.
critu	gismu			      	x_1 es el otoño/estación de cosecha del año x_2 en localidad x_3	Ver también {crisa},  {dunra},  {vensa}.
ctaru	gismu			      	x_1 es una marea (expansión periódica/cíclica) en x_2 causada por x_3
ctebi	gismu   	-teb-		      	x_1 es un labio/borde (parte del cuerpo) de orificio x_2 del cuerpo x_3	Ver también {korbi}.
cteki	gismu   	-tek-   	-ce'i-	      	x_1 es un impuesto/exacción/tasa a bienes/servicios x_2 impuesto/exigido a x_3 por autoridad/recaudador x_4
ctile	gismu			      	x_1 es una cantidad de petróleo/nafta de origen x_2
ctino	gismu   	-ti'o-		      	x_1 es una sombra de objeto x_2 causada por fuente de luz x_3
ctuca	gismu   	-ctu-		      	x_1 enseña a x_2 ideas/métodos x_3 sobre tema/asunto/objeto x_4 por método x_5	Ver también {cilre},  {tadni}.
cukla	gismu   	-cuk-		      	x_1 es redondo/circular/disco	Ver también {djine}.
cukta	gismu   	-cku-		      	x_1 es un libro con contenido/obra x_2 por autor x_3 para audiencia x_4 conservado en medio x_5
culno	gismu   	-clu-		      	x_1 está lleno/pleno de x_2	Ver también {kunti},  {tisna}.
cumki	gismu   	-cum-   	-cu'i-	      	x_1 (evento) es posible/puede ser/tal vez ocurra bajo condiciones x_2	Ver también {lakne}.
cumla	gismu   	-cul-		      	x_1 es humilde/modesto sobre x_2 (abstracción)	Ver también {jgira}.
cunmi	gismu			      	x_1 es una cantidad de mijo (grano) de especie/variedad x_2
cunso	gismu   	-cun-   	-cu'o-	      	x_1 (evento) es aleatorio/al azar bajo condiciones x_2, con distribución de probabilidad x_3	Ver también {funca},  {kalsa}.
cuntu	gismu   	-cu'u-		      	x_1 (evento) es un asunto/actividad de x_2
cupra	gismu   	-pra-		      	x_1 produce x_2 con proceso x_3	Ver también {zbasu}.
curmi	gismu   	-cru-		      	x_1 agente permite/autoriza/deja que ocurra x_2 bajo condiciones x_3	Ver también {fanta}.
curnu	gismu   	-cur-		      	x_1 es un gusano/lombriz de especie/raza x_2
curve	gismu   	-cuv-		      	x_1 es puro/no adulterado en propiedad x_2	Ver también {prane},  {manfo}.
cusku	gismu   	-cus-   	-sku-	      	x_1 dice/expresa x_2 a x_3 usando medio x_4	Ver también {bacru},  {tavla},  {casnu},  {spuda}.
cutci	gismu   	-cuc-		      	x_1 es un zapato/bota/sandalia/calzado (prenda de vestir) para cubrir/proteger pies x_2, de material x_3
cutne	gismu   	-cut-		      	x_1 es un pecho/tórax (parte del cuerpo) de x_2
